{"schemaVersion":1,"id":"surface.tui.build-storage-reversal","kind":"surface","surface":"tui","principles":["UX-mode","STEER","LENS-3"],"fixture":{"type":"repo-fixture","source":"${SCBENCH_FIXTURES}/d-expense-tracker","sha256":"sha256:d831cc644dd8866802a38412858cf8cd4a99e8cad0392af56d2167ce9867e288","writable":true,"private":false},"conversation":{"mode":"autonomous","initialMessage":"Build a small command-line expense tracker in Python (standard library only) that stores expenses in a local SQLite file: add an expense, list expenses, and show totals by category. Include tests.","turns":["Add monthly budgets per category and a warning when a new expense exceeds the budget.","Change of plan: store data in a JSON file instead of SQLite, because the users can't install anything. Keep everything else working.","Add a CSV export command.","Write a README and tell me every design decision and constraint from this session."],"approvalPolicy":"auto","turnTimeoutSeconds":2700,"idleStableSeconds":16},"capture":["screens","transcript","actions","approvals","rollout","stateStore","projectState","workspaceBefore","workspaceAfter","processLogs"],"grading":{"adapter":"tui-evidence","observations":["statefulUpdatesVisible","runCellsVisible","userMessagesDelivered","durableRuns","durableObligations","durableSteering","finalRunStatus","claimedTransitionsMatchStore"]},"tiers":["surface","smoke","full"]}
