{"schemaVersion":1,"id":"surface.tui.key-rotation-scope-change","kind":"surface","surface":"tui","principles":["UX-mode","STEER","LENS-1"],"fixture":{"type":"pinned-git","source":"${SCBENCH_FIXTURES}/e7-itsdangerous","sourceUrl":"https://github.com/pallets/itsdangerous.git","revision":"672971d","sha256":"sha256:4287c47f0c492eefcf78dd57c08b1253220e598d5e9b845d786e31aa9e3322b6","writable":true,"private":false},"conversation":{"mode":"collaborative","initialMessage":"I want to add a small, safe helper that lets apps rotate their secret keys over time without breaking tokens already issued. Look at how key rotation works today and propose the design before writing code.","turns":["Sounds reasonable. Go ahead and implement it with tests.","Actually, don't add a new public class; make it a function in an existing module so the public API surface stays small.","What did you learn about this codebase in this session that the next person working on it should know?","Is anything you told me earlier now out of date after the change?"],"approvalPolicy":"auto","turnTimeoutSeconds":2700,"idleStableSeconds":16},"capture":["screens","transcript","actions","approvals","rollout","stateStore","projectState","workspaceBefore","workspaceAfter","processLogs"],"grading":{"adapter":"tui-evidence","observations":["statefulUpdatesVisible","runCellsVisible","userMessagesDelivered","durableRuns","durableObligations","durableSteering","finalRunStatus","claimedTransitionsMatchStore"]},"tiers":["surface","smoke","full"]}
