{"schemaVersion":1,"id":"surface.tui.socratic-begin-execution","kind":"surface","surface":"tui","principles":["UX-mode","STEER","LENS-8"],"fixture":{"type":"external","source":"${SCBENCH_FIXTURES}/e1b-repohealth","sha256":"sha256:a05b357450a23abd6b9e228441b7e3c72ea003cdffb127fe21b306c180e9dd45","writable":true,"private":false},"conversation":{"mode":"socratic","initialMessage":"Review this small codebase for bugs, design problems and missing tests. Help me decide what to fix first.","turns":["Let's prioritize correctness over style. Which single issue should we fix first and why?","OK, agreed. Begin execution on that one fix.","resume this run","What remains on the list?"],"approvalPolicy":"auto","turnTimeoutSeconds":2700,"idleStableSeconds":16},"capture":["screens","transcript","actions","approvals","rollout","stateStore","projectState","workspaceBefore","workspaceAfter","processLogs"],"grading":{"adapter":"tui-evidence","observations":["statefulUpdatesVisible","runCellsVisible","userMessagesDelivered","durableRuns","durableObligations","durableSteering","finalRunStatus","claimedTransitionsMatchStore"]},"tiers":["surface","smoke","full"]}
