{"schemaVersion":1,"id":"surface.tui.parser-empty-value-investigation","kind":"surface","surface":"tui","principles":["UX-mode","LENS-2","HONESTY"],"fixture":{"type":"pinned-git","source":"${SCBENCH_FIXTURES}/e11-click","sourceUrl":"https://github.com/pallets/click.git","revision":"06b2a67","sha256":"sha256:bcdb1e4ffe8636680236067f3797026c0d60b70f3b7c7f82e84ba6b1513fdebe","writable":true,"private":false},"conversation":{"mode":"autonomous","initialMessage":"Investigate: in this CLI library, how does passing an option as `--name=` (empty value after equals) differ from `--name ''`, and from omitting it? Find the exact code paths and tell me if any behaviour looks like a bug.","turns":["Write a minimal reproduction script for whatever surprised you, run it, and show me the output.","If there is a bug, fix it with a test. If not, explain why the behaviour is intended.","Summarize what you now understand about the option parser that you did not know at the start."],"approvalPolicy":"auto","turnTimeoutSeconds":2700,"idleStableSeconds":16},"capture":["screens","transcript","actions","approvals","rollout","stateStore","projectState","workspaceBefore","workspaceAfter","processLogs"],"grading":{"adapter":"tui-evidence","observations":["statefulUpdatesVisible","runCellsVisible","userMessagesDelivered","durableRuns","durableObligations","durableSteering","finalRunStatus","claimedTransitionsMatchStore"]},"tiers":["surface","smoke","full"]}
